{"artifacts":[{"artifact_id":"pr-contract","artifact_type":"PR","authority_class":"DELIVERY_ARTIFACT","evidence_ceiling":"L2","external_identity":"pr:ed3c/skills-shared#501","mutable":true,"observed_subject":{"freshness_policy":"REFRESH_BEFORE_DECISION","observed_at":"2026-08-19T12:00:00Z","ref_or_identity":"agent/test","repository":"ed3c/skills-shared","sha":"1111111111111111111111111111111111111111"},"schema_version":"artifact-projection/v1","trace":{"case_ids":["CASE-CONTRACT"],"icpg_graph_digest":"sha256:06fe61e1c6bf68281f8a483294caf2323c076da4165a9c21077babd4bbea52c2","intent_id":"intent:example","invariant_ids":["INV-CONTRACT"]}},{"artifact_id":"file-contract","artifact_type":"FILE","authority_class":"IMPLEMENTATION","evidence_ceiling":"L2","external_identity":"path:ed3c/skills-shared@1111111111111111111111111111111111111111:feature/contracts.py","mutable":false,"observed_subject":{"freshness_policy":"IMMUTABLE","observed_at":"2026-08-19T12:00:00Z","ref_or_identity":"agent/test","repository":"ed3c/skills-shared","sha":"1111111111111111111111111111111111111111"},"schema_version":"artifact-projection/v1","trace":{"case_ids":["CASE-CONTRACT"],"icpg_graph_digest":"sha256:06fe61e1c6bf68281f8a483294caf2323c076da4165a9c21077babd4bbea52c2","intent_id":"intent:example","invariant_ids":["INV-CONTRACT"]}},{"artifact_id":"agents-contract","artifact_type":"AGENTS","authority_class":"PROCEDURE","evidence_ceiling":"L1","external_identity":"path:ed3c/skills-shared@1111111111111111111111111111111111111111:feature/AGENTS.md","mutable":false,"observed_subject":{"freshness_policy":"IMMUTABLE","observed_at":"2026-08-19T12:00:00Z","ref_or_identity":"agent/test","repository":"ed3c/skills-shared","sha":"1111111111111111111111111111111111111111"},"schema_version":"artifact-projection/v1","trace":{"case_ids":["CASE-CONTRACT"],"icpg_graph_digest":"sha256:06fe61e1c6bf68281f8a483294caf2323c076da4165a9c21077babd4bbea52c2","intent_id":"intent:example","invariant_ids":["INV-CONTRACT"]}},{"artifact_id":"receipt-contract","artifact_type":"RECEIPT","authority_class":"EVIDENCE_RECEIPT","evidence_ceiling":"L3","external_identity":"receipt:ed3c/skills-shared#contract","mutable":false,"observed_subject":{"freshness_policy":"IMMUTABLE","observed_at":"2026-08-19T12:00:00Z","ref_or_identity":"agent/test","repository":"ed3c/skills-shared","sha":"1111111111111111111111111111111111111111"},"schema_version":"artifact-projection/v1","trace":{"case_ids":["CASE-CONTRACT"],"icpg_graph_digest":"sha256:06fe61e1c6bf68281f8a483294caf2323c076da4165a9c21077babd4bbea52c2","intent_id":"intent:example","invariant_ids":["INV-CONTRACT"]}},{"artifact_id":"pr-core","artifact_type":"PR","authority_class":"DELIVERY_ARTIFACT","evidence_ceiling":"L2","external_identity":"pr:ed3c/skills-shared#502","mutable":true,"observed_subject":{"freshness_policy":"REFRESH_BEFORE_DECISION","observed_at":"2026-08-19T12:00:00Z","ref_or_identity":"agent/test","repository":"ed3c/skills-shared","sha":"1111111111111111111111111111111111111111"},"schema_version":"artifact-projection/v1","trace":{"case_ids":["CASE-CORE"],"icpg_graph_digest":"sha256:06fe61e1c6bf68281f8a483294caf2323c076da4165a9c21077babd4bbea52c2","intent_id":"intent:example","invariant_ids":["INV-CORE"]}},{"artifact_id":"file-core","artifact_type":"FILE","authority_class":"IMPLEMENTATION","evidence_ceiling":"L2","external_identity":"path:ed3c/skills-shared@1111111111111111111111111111111111111111:feature/core.py","mutable":false,"observed_subject":{"freshness_policy":"IMMUTABLE","observed_at":"2026-08-19T12:00:00Z","ref_or_identity":"agent/test","repository":"ed3c/skills-shared","sha":"1111111111111111111111111111111111111111"},"schema_version":"artifact-projection/v1","trace":{"case_ids":["CASE-CORE"],"icpg_graph_digest":"sha256:06fe61e1c6bf68281f8a483294caf2323c076da4165a9c21077babd4bbea52c2","intent_id":"intent:example","invariant_ids":["INV-CORE"]}},{"artifact_id":"readme-core","artifact_type":"README","authority_class":"NAVIGATION","evidence_ceiling":"L1","external_identity":"path:ed3c/skills-shared@1111111111111111111111111111111111111111:feature/README.md","mutable":false,"observed_subject":{"freshness_policy":"IMMUTABLE","observed_at":"2026-08-19T12:00:00Z","ref_or_identity":"agent/test","repository":"ed3c/skills-shared","sha":"1111111111111111111111111111111111111111"},"schema_version":"artifact-projection/v1","trace":{"case_ids":["CASE-CORE"],"icpg_graph_digest":"sha256:06fe61e1c6bf68281f8a483294caf2323c076da4165a9c21077babd4bbea52c2","intent_id":"intent:example","invariant_ids":["INV-CORE"]}},{"artifact_id":"receipt-core","artifact_type":"RECEIPT","authority_class":"EVIDENCE_RECEIPT","evidence_ceiling":"L3","external_identity":"receipt:ed3c/skills-shared#core","mutable":false,"observed_subject":{"freshness_policy":"IMMUTABLE","observed_at":"2026-08-19T12:00:00Z","ref_or_identity":"agent/test","repository":"ed3c/skills-shared","sha":"1111111111111111111111111111111111111111"},"schema_version":"artifact-projection/v1","trace":{"case_ids":["CASE-CORE"],"icpg_graph_digest":"sha256:06fe61e1c6bf68281f8a483294caf2323c076da4165a9c21077babd4bbea52c2","intent_id":"intent:example","invariant_ids":["INV-CORE"]}},{"artifact_id":"issue-gap","artifact_type":"ISSUE","authority_class":"EXECUTION_ARTIFACT","evidence_ceiling":"L1","external_identity":"issue:ed3c/skills-shared#503","mutable":true,"observed_subject":{"freshness_policy":"REFRESH_BEFORE_DECISION","observed_at":"2026-08-19T12:00:00Z","ref_or_identity":"agent/test","repository":"ed3c/skills-shared","sha":"1111111111111111111111111111111111111111"},"schema_version":"artifact-projection/v1","trace":{"case_ids":["CASE-GAP"],"icpg_graph_digest":"sha256:06fe61e1c6bf68281f8a483294caf2323c076da4165a9c21077babd4bbea52c2","intent_id":"intent:example","invariant_ids":["INV-GAP"]}}],"edges":[{"from":"intent:example","relation":"TRACKED_BY","to":"pr-contract","utility":"IMPLEMENTATION"},{"from":"pr-contract","relation":"TOUCHES","to":"file-contract","utility":"IMPLEMENTATION"},{"from":"file-contract","relation":"VERIFIED_BY","to":"receipt-contract","utility":"EVIDENCE"},{"from":"agents-contract","relation":"PROTECTS_CASE","to":"intent:example","utility":"AUTHORITY"},{"from":"intent:example","relation":"TRACKED_BY","to":"pr-core","utility":"IMPLEMENTATION"},{"from":"pr-core","relation":"TOUCHES","to":"file-core","utility":"IMPLEMENTATION"},{"from":"file-core","relation":"VERIFIED_BY","to":"receipt-core","utility":"EVIDENCE"},{"from":"readme-core","relation":"DOCUMENTS_INVARIANT","to":"intent:example","utility":"RETRIEVAL"},{"from":"intent:example","relation":"TRACKED_BY","to":"issue-gap","utility":"IMPLEMENTATION"}],"intents":[{"acceptance_criteria":["bidirectional traversal"],"authority_boundary":"Human/repository authority remains external","desired_outcome":"trace why to proof and implementation back to why","icpg":{"case_ids":["CASE-CONTRACT","CASE-CORE","CASE-GAP"],"graph_digest":"sha256:06fe61e1c6bf68281f8a483294caf2323c076da4165a9c21077babd4bbea52c2"},"intent_id":"intent:example","invariants":["authority aware"],"non_goals":["duplicate ICPG case truth"],"schema_version":"intent-projection/v1"}],"required_traversals":["WHY_TO_PROOF","IMPLEMENTATION_TO_WHY","AGENT_CONTEXT_ROUTE","GAP_PROPAGATION"],"schema_version":"intent-to-evidence-trace-graph/v1","subject":{"ref":"agent/test","repository":"ed3c/skills-shared","sha":"1111111111111111111111111111111111111111"}}
